,post_id,author,location,date,post
0,183301151,Sara Lange,South Park Hill,12 Apr,"Homeless Encampment Near You! If you thought the crime was getting bad around here lately Park Hill, just wait until a sanctioned homeless encampment arrives in a parking lot near YOU! Did you hear about the one that just blew up because of a homemade drug lab inside?! See the story for ways to possibly voice your concern...unless you're afraid to show your face on camera, that is! I'm personally VERY concerned about how this story seems to be flying under the radar.

https://kdvr.com/news/local/sanctioned-homeless-encampment-coming-to-affluent-south-park-hill/"
1,183076475,Eugene Simar,East Colfax,11 Apr,Gunshots Heard. I heard about 6 or 7 gunshots.
2,182618509,Jeff Gurney,South Park Hill,6 Apr,Sanctioned Homeless Camp. Park Hill is getting a sanctioned homeless camp. Watch tonight on CBS4 at 10
3,181960531,Grace Cheng,Lowry,31 Mar,Care bags for the homeless. Does anyone have ideas on where to donate care bags (with hygiene items and snacks) for the homeless?
4,181416850,Rachel Kennedy,Central Park,26 Mar,"Where to donate blankets? Hi all- I have different types of blankets, some hand knitted that I would like to donate to a shelter/organization. Does anyone have any recommendations for who is accepting? 

Thank you!"
5,183332878,Ismerai Rodriguez,East Colfax,13 Apr,Campsites. Hi everyone! Any recommendations on more private campsites for tents?
6,182732086,Michael King,South Park Hill,7 Apr,"Homeless Tent City in North Park Hill?  When were we able to voice our say on this? To whom it may concern (and it should concern everyone) in our wonderful North Parkhill neighborhood:

I was  literally floored and became sick to my stomach once I heard the news that 
Was just presented to me by a friend.  Honestly  I can’t see how this location would be considered an appropriate location for housing homeless population.  This was apparently approved “under the radar” and was in the works without many knowing about it!  Question:  Who is going to police this and keep our children’s safety top priority? Who is going to keep the area sanitized and clean of debris that we already see all over the city where these tent cities currently exist?  Not to mention our property values will likely diminish as a result of this horrible decision.. I am all for finding an appropriate location to house our homeless population, but as a tax payer it would have been nice to have had a say in the decision, but instead it was pushed through under the radar!  I mean really, smack dab in the middle of our established neighborhood that is literally a block from our public library and grade school? This is the “Wrong” location and the “Wrong” decision by our state and local authorities.  Ultimately This will present a major safety issue for our neighbors  and our children, and is a very very bad thing for North Parkhill overall..  Something needs to be done to stop this atrocity!   

https://denverite.com/2021/04/05/park-hill-united-methodist-church-will-host-denvers-next-sanctioned-camp-site-for-people-experiencing SL -homelessness/"
7,182464076,Sophie Swanson,South Park Hill,5 Apr,Park Hill United Methodist Church will host Denver’s next sanctioned camp site for people experiencing homelessness. https://denverite.com/2021/04/05/park-hill-united-methodist-church-will-host-denvers-next-sanctioned-camp-site-for-people-experiencing-homelessness/
8,183900386,Jamie Tenace Tenace,Lowry,6 days ago,"Kitchen utensils. I’m looking for an organization who serves food , looking to donate several sets of silverware and some utensils. I’d rather give them to an organization than goodwill. Or really any place that could use forks knives spoons ect."
9,182589486,Gilberto Martinez,Northeast Park Hill,6 Apr,Hi neighbors. I’m Gilberto. 👋. I’m 18 years old and have lived in park hill for the past 4-5 years. I recently enlisted in the marines and am taking apart in helping the homeless for my senior project.
10,184201216,Jerrica Zimmermann,North Park Hill,3 days ago,"We can do better. It took me just three blocks walking down the median on Monaco to pick up all this litter.  

It’s overwhelming to consider the scope and scale of environmental degradation experienced even in our lifetime, but doing even the tiniest bit makes a difference. Sure, picking up a few pieces of litter might seem nearly inconsequential when you think about the big picture. But here’s the thing—it feels tangible. Immediate. And you know what else? It feels GOOD!  I hope seeing me out there can inspire others to perhaps give back as well. To care. And ultimately, to feel just a little less overwhelmed.

Not that you need a reason, but Earth Day is on Thursday. I encourage you to do something good for our community and planet! 🌎🌍🌏"
11,180663210,Melly Kinnard,Lowry,19 Mar,"DO YOU HAVE A 3'X6' BOOKCASE YOU CAN DELIVER FOR A SHELTER? Colorado Coalition for the Homeless operates Fusion, at 3737 Quebec.  This is a former hotel housing residents who have recently been homeless.  Your bookcase will be used for books for residents.  Questions?  denvermelly@msn.com"
12,181986323,Laura Avant,Northeast Park Hill,31 Mar,"The homeless laundry is done!  A shoutout to the laundromat. Well, thanks to the detergent and dryer sheets from my neighbors and my husband's time and back, we got the laundry done.  We took it to Suds laundromat at 20th and Clarkson (photos attached) and they really did let us use the large washers and dryers for free.  Sop if you need a laundromat to wash your own laundry, give them a try.  Yovonne was very helpful (besides being stylish) and courteous.  I swear the photo had her face in it.

Then I had 3 huge bags for St. Francis Center and 2 for Samaritan House which I delivered yesterday.  There were lots of jeans and blankets, real treasures to the shelters.

Many thanks to those who donated clothing and laundry supplies.  I have since received 2 more donations, so I may stop raiding the homeless camps and jeopardizing my health.

Just remember me when you have something (virtually anything) to donate.  You can scan for Resurrection Clothing to find me.  These clothes truly were resurrected."
13,141220585,"Tom Green, 9NEWS",,20 Mar 20,"United as a community. Hi everybody, this is Tom Green with 9NEWS….I’d like to know how you’re doing, and what you may be doing to help out someone who may be struggling right now. 

Self-isolation, or “social distancing”, may be something that you never thought would be a part of our lives, but here it is.  The thing is, it doesn’t have to feel so isolating if we are in this together.  For me, knowing that we are helping each other out can be a real inspiration - an important part of what we need to be united as a community. 

Let me know what you’re doing to help…and please, stay safe & be healthy."
14,176771259,Brianna Lennon,North Aurora/Fitzsimons,12 Feb,I Dont wanna be homeless. Is therre any cheap apts or low income accepting apps in the area im on the verge of being homeless i have exhausted my help. I need to move asap
15,182738883,Jacqui Shumway,South Park Hill,7 Apr,"Positive Story on SOS in Park Hill. UPDATE: Zoom Meeting Monday, April 19, 2021 at 7 PM MDT – 8:30 PM MDT Online: us02web.zoom.us
Thank you to Channel 7 for doing such a positive story on our efforts to be a good neighbor to all of our neighbors.  
https://www.thedenverchannel.com/news/local-news/new-safe-outdoor-space-for-people-experiencing-homelessness-to-open-in-park-hill"
16,182555445,News,,,"16th Street Mall project advances to final design and construction. From 9NEWS: ""Denver will soon reimagine, reconstruct, and revitalize downtown's 16th Street Mall."""
17,183074081,Melanie Sanders,Wash Park West,Anxiety/Depression Support Group,"Rent ? Hello, my boyfriend is looking for a place to live. He is open to work, about to be homeless but depressed and does not know where to go. Help please! Thanks"
18,180121987,City of Denver,,14 Mar,"Winter Weather Preparedness and Safety Information. Various City and County of Denver agencies continue to provide snowstorm response measures this weekend to help ensure safety across the city. The city’s Emergency Operations Center was activated yesterday and continues to monitor the storm and its impacts. Make sure to stay home, stay safe, and stay prepared. 

➡️ In case of a power outage, make sure to charge your phone and have extra batteries on hand.
➡️ Don’t drive if you don’t have to.
➡️ Wet, heavy snow can weigh down tree branches and cause them to break. Check to make sure the tree is safe and clear of all utility lines before removing snow.
➡️ Stay clear of downed lines and report them immediately to Xcel Energy at 1-800-895-1999.
➡️ Make sure your sidewalks are free and clear of ice and snow and lend a helping hand to neighbors who need help shoveling! 
➡️ Many sheltering beds remain open & available to receive guests from the storm. First responders & street outreach teams continue to connect with people experiencing homelessness, providing referrals and transportation to emergency shelters. More details at denvergov.org/emergencyshelter
➡️ Don’t leave your pets outside. If the weather is too bad for you and your family, it’s also not safe for your pets.

📷 : IG @mandomatic"
19,177488283,Chantiel Duran,Barnum,From One Neighbor To Another,Hi everyone. Hi my name is Monique and I am in need of some help right now I am homeless sleeping outside anything will help and I would really appreciate it I am willing to do work for help with a hotel room please call me at 7207153520
20,183906949,Jim Hannifin,South Park Hill,6 days ago,"Regarding PHUMC Safe Outdoor Space. Some people might presume that many of the people who are out on the streets are there because they were criminals, pedophiles, addicts - or at least maybe anti-social, and based on that might oppose a fenced Safe Outdoor Space tent village in our neighborhood. Of course! Mostly they’re pretty regular folks, though, it turns out.

Our nation used to have a different economic and social framework than we have today. One of the social support structures that our forebears had were their Churches. God bless PHUMC for stepping up to re-take that role.  So far, churches have been the only landowners to offer usable land for Safe Outdoor Spaces to move people off the street curbs.

Regarding S.O.S.s: The difference between the improvement of moving from an apartment into your first house does not remotely compare to the improvement of moving from a tent on a city street-curb, into a tent within a fenced-in enclosure of a church parking lot with san-o-lets, trash service, social structure, electricity, and no fear of having your base “swept” away by city cleaning crews any random day. An S.O.S is still minimal, but is a haven of peace to people who need a haven of peace. 

A precedent: The S.O.S. in the church lot on 16th and Pearl was already built before they decided that they were going to invite everyone from what I saw as the wild filthy crazy “un-sanctioned” camp across the street, to move into the new S.O.S. It’s what I think a Jesus would have done, but still I expected disaster. (And I was one of the volunteers!) Yet when I visited it two weeks later, and multiple times since, it is a Haven of Peace. There are one or two bright bold larger than life characters, but there is peace and security, and there is healing and grace. It is managed by a firm and loving staff and appreciated by grateful campers.

I do not think the larger neighborhood will be impacted for the worse by this camp. (Note there are background checks because of the nearby day-care, too.) I hope they will be surprised to find that the lot has been transformed into something more humanely beautiful and somehow more tranquil than a barren asphalt lot. And it is only for six months.

Kids can still play. Children have agile perception. Teach kids to be wary, but not afraid. That’s how I grew up and I feel my life is richer, for it.

These people who will stay in an S.O.S. aren’t the dregs that a “worst-case” mindset imagines; and we need to do something better than what has been done until now for our fellow humans.  I am proud of this church, and of Park Hill, for stepping up, and I hope that we can crow to the rest of the city: This is what Park Hill does, and you can, too.

(And if it turns out it isn’t “all that”, we can adjust things!)"
21,180430623,Claire Gerrish,Historic Montclair,17 Mar,"Covid vaccinations appointments. All, I was having trouble finding available appointments and stumbled on this. Thought I would share as I think it is challenging to find availability for those eligible. If others have tips to getting appointments, please share! Thank you to the person who created this website! 

https://www.vaccinespotter.org/CO/?zip=80220"
22,180920051,Laura Avant,Northeast Park Hill,21 Mar,"Save me from myself! I am absolutely not proud about getting good warm clothing to the homeless.  I have been known to raid abandoned homeless camps for clothing to take home to wash and dry and donate to the shelters.  But these last two weeks really took the honors for OCD clothes gathering.  I was down at St. Francis Center giving out  handmade hats and scarves from Knitting for Peace when I noticed a lot of clothing on the ground, in the gutter, and under snow and trash.  I did as an OCD social worker would do and picked them up, put them in my car and took them home.  The items I got last week were washed and dried, folded and sorted and taken to the two shelters I donate to.  
Then Friday I did the same thing again but intended to get it all back to the people there before the snow started and give it directly to them.  I didn't make my own deadline so the two bags are still here while a sleeping bag hangs over the shower curtain.

I would so much rather deal with the nice, clean stylish and warm donations that this community has been offering me, but my donations have dried up lately.  If you can save me from this ridiculous practice of resurrecting dirty abandoned clothing by donating, please do.    I am attaching photos of the latest OCD bags ready to be washed.  

One of the reasons for the unending need for clothing is that COVID has halted the laundry trucks that used to make stops at various homeless areas for people to hand in dirty clothes to be washed and dried and returned to them.  Now when things get dirty or wet, they have no recourse for washing them.  I certainly can't afford the laundry products, hot water, and gas to go down town all the time on my social security, but I would gladly  take cash donations so I can continue to ""resurrect"" these things.  Then I could go to a big laundromat and wash a lot at once.  As with your donations, you may PM me, email me or call at 303-316-6748 to arrange for delivery or pick up.

On the other hand, take a look through your closet and drawers to find clothing or household items to donate (Samaritan House gives household items to families leaving the shelter.) and let me know.  I'll get my OCD self to your place or welcome you here."
23,178601768,Tracy Richmond,East Colfax,28 Feb,"Seeking a good charity for household items, boys and women's clothing. Hi neighbors, looking for a good charity to donate some things.  When I have donated to my local ARC, they were throwing decent things in the dumpster before I had even pulled away. Disappointing. I'm looking for a place that can put them to good use or put any profits to good use in the community.  Any recommendations?"
24,184234764,Abby Leeper,Northeast Park Hill,3 days ago,"Where should I donate gently used clothes and books? Hi neighbors, 

We’re decluttering and I have several boxes of clothes, books and assorted household items I’d like to donate. I appreciate recommendations on the best place to do this, especially locally. Thank you!"
25,183413177,Marie Allred,Sloans/Highlands,From One Neighbor To Another,"Need ideas. Hi everyone. Hello everyone I really hate to go on this and ask but I'm looking for some resources to pay some of the bills that I haven't gotten caught up on my rent but I have late fees and the organizations won't help me pay them. I've tried to get approved for Medicaid and for some reason I cannot. I have two medications that I have to pay for for my diabetes I went through GoodRx and found kind of cheapest I could since I cannot work because of my disability I've tried and failed if anyone can help or donate or give me ideas how to get myself caught up, I would really appreciate it thank you"
26,182688665,Laura Avant,Northeast Park Hill,7 Apr,"The lady who takes clothes to the homeless. I saw a question the other day asking who I am and started to reply before my clumsy fingers made me leave my phone.  Now that I am on my laptop, I can't find that question.  So for her, any newbies, and those who need a reminder, 
Resurrection Clothing is still gathering, sorting and taking clothing downtown to two shelters.  I just took a huge load that took two trips.  Then I went to the ARC and spent the last of my vouchers on men's and women's underwear.  But at least I didn't have to go to an abandoned camp to dig the clothes out of the trash.  Your donations are saving me."
27,179123066,Janeen Farmer,Lowry,5 Mar,Contribute toiletries. Did I see a request for toiletries to be given to shelters? I gathered up a couple of bags and need to know where to drop these off?
28,180587436,Madelyn Reid,South Park Hill,18 Mar,Donate blankets. I have some used comforters that I'd like to donate. I'm not sure if animal shelters like the poofy blankets or if homeless shelters take them since they're not sleeping bags. Please let me know if anybody has any recommendations or info. Even better if anybody does ppu ☺️
29,176696151,Ruby Robledo,Montbello,11 Feb,Homeless in this weather 🥺. It’s so cold out I really hope many have found shelter 🏠 I can’t even imagine it’s ice cold out and please put your pets inside .
30,183175962,Marie Allred,Sloans/Highlands,From One Neighbor To Another,Resources. Hello everyone I really hate to go on this and ask but I'm looking for some resources to pay some of the bills that I have I've gotten caught up on my rent but I have late fees in the organizations will help me pay them I've tried to get approved for Medicaid and for some reason I cannot I have too medications that I have to pay for for my diabetes I went through GoodRx and kind of cheapest I could since I cannot work I've tried and failed if anyone can help or give me ideas how to get myself caught up I would really appreciate it thank you
31,139471884,Tom Fesing,East Colfax,4 Mar 20,"7 Star Motel turned into Affordable Housing for Artists 😃. https://www.westword.com/arts/night-window-is-an-experiment-in-affordable-housing-for-artists-in-denver-11652780?fbclid=IwAR14TWVYD97uCwwPDwlCiqbBkRsL_AcCzxCAFy1og58hATH8vjtwAdCLnRM

http://nightwindowcolfax.com/index.html"
32,177386735,Ennia Rodriguez,North Aurora/Fitzsimons,17 Feb,Cats (strays??)e. There a 2 big fluffy beautiful  white and black cats. Seem they are unseparable . I feel sorry for them! They are always in the cold !! I sometimes drive by on my way to work and have fed them. I'm  wondering are they someone's pets?? And if so why??? Are they outside in these elements?🥺 they are on Nome and 19th corner house.
33,179028356,Laura Avant,Northeast Park Hill,4 Mar,"Welcome new members.  Here is a chance for you to do something to help our homeless people.e. This neighborhood group is very generous and kind to those in need.  One of the good things they have done is help me provide warm clothing, survival gear  and household items to our homeless population.  They have donated warm coats, pants, clothing, even artwork, infants' and children's clothing, etc. for me to take to 2 shelters every time I have a load.  So to live up to the level of this group, let me encourage you to go through your stuff, find things you don't need any more, and let me know.  I'll pick up or ask you to deliver it to me and take it all downtown right away.  Bless you all."
34,175331575,Kelsey Kistler,East Colfax,29 Jan,"Woman sitting on my porch - Colfax and Ulster. I woke from a nap to see a woman in gray sweatpants and a navy blue jacket with a hood sitting on my porch. She didn’t knock or anything. When I looked out my window we made eye contact but she acted as if nothing was wrong. I asked her politely through the window to please get off my porch. She didn’t even flinch. Finally, I yelled for her to get off my property and she obliged. She slowly started walking off towards 16th. Is that strange or am I just paranoid?

Person 1
Top: Navy blue hooded jacket 
Bottom: Gray sweatpants"
35,182347254,Jody McGuirk,Central Park,4 Apr,"If you found a $100 bill laying on the ground in front of a house in the neighborhood would. You knock on the door of the house it was in front of to find out if they had dropped it? OR

Pick it up and ride away on your bike with it with your two children with you?"
36,177737993,Daniel Webb,Lowry,20 Feb,"Tell me something good. I rarely use this site anymore because it’s devolved into basically a bunch of complaints about people’s dogs pooping in my yard, or some a hole that ran a stop light and made me smash the brakes on my mini van.   

So...   tell me something good today.   Make me smile."
37,180883098,Kay Dragon,Hoffman Heights,21 Mar,"Trash cans on I225 and 6th ave. I have great compassion for the homeless community and realize the 6th ave west, under the bridge is home for some. I know they have nowhere else to go but the trash is terrible. I am not talking about people's belongings, I am talking about garbage, food wrappers, plastic bottles, and other stuff. Could the city, ( The Mayor!) do something to put some trash cans in these places so people can use them for trash"
38,183319453,News,,,"As the need grows for shelters for minors experiencing homelessness, Denver chips in money for services. From Denverite: ""City Council approved two contracts worth $1.6 million for Urban Peak, which serves people ages 15 to 24."""
39,181617442,Christopher Belila,Aurora Arts District,28 Mar,"We are A-Town!  Post cleanup update! Thanks to all the volunteers who helped with yesterday's cleanup. Our next one is scheduled for Saturday April 24th.  We've partnered with Waste Management to provide 2 roll-off dumpsters for residents to throw away large items. More on this soon.

My dog Lucy and I went for a walk this morning in the Art's District and it still looks pretty good.  However, I was struck by s liquor store at Florence St and Colfax.  Volunteers cleaned up the area in front and across the street from the liquor store, and we must have picked up 30 empty shot or 1/5 bottles.  This morning there was just as many empty bottles.  I noticed the store opens at 8:00 each day, and customers are pouring in there, and some are throwing out empty bottles almost immediately.

The question I have is should businesses that contributes to homeless, alcoholism, and an unsavory environment be allowed to stay open.  I'm going to lobby the city council to change the zoning rules for the Art's District.  

I may start a petition to garner support and show city council this is important.

Have a great day.  Chris"
40,174491858,Rick and Cathy Reynolds,South Park Hill,21 Jan,"Homeless shelter. I am looking for a women's homeless shelter so I can donate socks, purses, and jackets."
41,178354586,Erica Heft,Northeast Park Hill,25 Feb,It’s great to be here. I’m Erica. Hi friends! We have been park hill residents for over 5 years and have loved every minute of it. We are moving and need to get rid of some things and hope they can find a new loving home!
42,176293867,Gerry Colgrove,East Colfax,8 Feb,It’s cold outside. I was down at the corner last night and saw a man not enough winter clothes who is homeless. I came home and got what I could get. I got him a pair of warm sweatpants a jacket pairs of socks and a pair of boots and two coats .I am looking for donations that I can go hand out to cold people in need. Not 100% sure how to go about this but any advice is good .warm gear donations and good sleeping bags and blankets any thing helps.
43,181133549,ariel h.,Hoffman Heights,23 Mar,Mobile mechanic. My car was unfortunately broken in to sometime during the last 2 days and my car was vandalized and disabled from them pulling the dash board covers off along with ripping out my ignition switch. Does anyone have any recommendations for a mobile mechanic that would be able to come replace it that can do the job ASAP. Thanks
44,179892143,John Hand,Central Park,12 Mar,"Homeless and the pending snow event. Morning all!  

Asking for all of us to be mindful of those that are homeless for this upcoming snow event (especially). 
Might you have any winter clothing items? Jackets, gloves, sweaters, etc.  that you could give to either in person to those out in the elements? IDEAS: Put together a small bag of items and hand them through your window or donate cash in an envelope (virus concerns). Dog/cat food for those with pets is wonderful too.  Small food bags of bottled water and granola bars are great as well. 

No matter the circumstances of them being homeless at the moment;  ABOVE all they are human and deserve kindness and compassion. ESPECIALLY in horrible weather conditions. 
Remind ourselves that it CAN & COULD happen to anyone. 
Yes, even me or you."
