,post_id,author,location,date,post
277,160852835,Kim Briggs,North Aurora/Fitzsimons,9 Sep,"Winter gear drive for homeless. Helping Hands for the Homeless Denver is needing winter gear to help our street friends survive! This is a desperate need as our gear is slowly depleting. Winter is supposed to be bad this year and we want to make sure our friends are prepared. 

We are accepting all winter clothing for adults(hats, boots, gloves, scarves, shirts,  pants, jackets). We are also looking for blankets, sleeping bags, used tents, hand warmers, backpacks. 

Donations are tax deductible. 
Porch drop off at 1797 Oakland st Aurora CO. 
If you'd like a receipt, message me after you drop off and I'll email you one."
278,158216007,Danny Alvarez,Northeast Park Hill,15 Aug,So...what's going on in the Park Hill golf course parking lot? Drove by today and saw a bunch of cops and cars parked in there as well as some porta potties. Curious as to what all the activity is about
279,155657139,News,,,"Denver officials OK pricey repairs and a facelift for wrinkly 16th Street Mall despite outcry over other priorities. From Denverite: ""Expect wider sidewalks, a new layout for the busway and pavement that doesn't break. Sometime in 2023 maybe."""
280,172166506,Claire Treacy,Lowry,29 Dec,"ISO 12 & 15 LB hand weights to buy. Hello. If anyone has a set of either 12 lb or 15 lb (or both!) hand weights they no longer use/need and would like to sell, please let me know!

Thank you and HNY!"
281,172771539,City of Denver,,5 Jan,"Denver Moves to Level Orange on COVID-19 dial. Yesterday, Denver moved back to Level Orange on the Colorado Department of Public Health and Environment COVID-19 Dial. The move comes with increased capacity limits at many local businesses, including a return to indoor dining at restaurants. 

Level Orange capacity limits include:
- 25% or 50 people, whichever is fewer, indoors at restaurants
- 25% or 25 people, whichever is fewer, at gyms and fitness businesses
- 10 p.m. on-premises last call
- 25% capacity at offices
- 50% capacity remains for retail businesses

For details, please visit the state’s website: https://covid19.colorado.gov/data/covid-19-dial-dashboard#restrictions

If COVID-19 levels reverse and begin to escalate again, the state may re-impose greater restrictions. If cases, hospitalizations, and the positivity rate remain on a significant decline, the state could move Denver back to a less restrictive level."
282,169993923,Tiffney James,Lowry,6 Dec,"Christmas 🎄 gifts for my boys. Hello neighbors, 
I was just posting to see if anyone had any gently used toys or clothing I could possibly wrap and put under our tree? My husband works very hard but it’s paying the bills and I’d like to take some of the stress of toys and Christmas off of him. I’m a stay at home mom of a 3 and 7 year boys and a 13 year old girl since COVID hit but my daughter is spending the holidays with her grandma so my mom has her covered I’d just like to get the boys a couple things. Thank you for reading times are hard right now I appreciate any and all help. I will update the post if I get help. Thank you to all. Happy holidays! ❤️ 
Tiffney"
283,175451831,Ruby Robledo,Montbello,30 Jan,BAKERY BOXES ? HI friends just wondering if anyone know of any place to buy a bundle of windows cake boxes other then Amazon and Walmart is to pricy 2 boxes cost 10 and some . Plz let me know and maybe even wine boxes anyone ??? Looking for something like the pic below . Thank you 🙏
284,175451908,Ruby Robledo,Montbello,30 Jan,BAKERY BOXES ? HI friends just wondering if anyone know of any place to buy a bundle of windows cake boxes other then Amazon and Walmart is to pricy 2 boxes cost 10 and some . Plz let me know and maybe even wine boxes anyone ??? Looking for something like the pic below . Thank you 🙏 😊
285,174401619,Sonia Jimenez,Montbello,20 Jan,"Help with cat food. Hello Neighbors!

I was hoping someone would be able to help me with cat food for my babies.  I was able to get some cat food from a Pet Pantry, but unfortunately, since beggars can't be  choosers, I had to take what they gave me. This isn't working out at all for my kitties and they keep vomiting up the different foods that they get :(
I normally feed them Friskies shreds canned cat food and they do well on it.  If anyone is able to trade with me for me to get more Friskies shreds/meaty bits (no beef flavor-beef makes them trow up, too), that would be wonderful!  I have one 13 lb bag of Purina Cat Chow Gentle dry, (can't give them dry, either, I have a male prone to urinary problems), and 20 cans Science Diet and Pure  Vita canned foods. It would be a shame to not find a use for this food and also a big help in providing my guys with their much needed food.

Thanks so much!"
286,173552553,Jamie Tenace Tenace,Lowry,12 Jan,"Toiletries. Where can I donate a bag of travel size toiletries, shampoo, conditioner, soaps things like that. Stuff you would get out of hotels when you travel    Any suggestions?"
287,155678844,City of Denver,,22 Jul,"Denver Days 2020 - Re-imagined. Denver Days 2020 - August 1-9 - has been reimagined to provide inspiration for our residents and enhance the idea of community coming together. This year, in lieu of block parties, Denver Days 2020 will stage mini-parades through each of the 11 City Council Districts. Parade routes will be announced soon, and residents are invited to step onto their yards or balconies to join in the celebration as we pass through the neighborhood. Mention us and use #DenverDays in your photos and videos for a chance to be featured or to win great giveaways created by local artist Santiago Jaramillo. For details and parade routes, please visit https://www.denvergov.org/content/denvergov/en/denver-days.html."
288,156274774,News,,,"""This is far from over,"" Denver Mayor Hancock says in State of City address. From The Denver Post: ""Facing economic hardship, homelessness, a tax shortfall and the possibility of a strong resurgence of the coronavirus pandemic in Denver ..."""
289,174010975,Sarah Sheehan,Holly Hills,From One Neighbor To Another,Hi everyone. Hi! I am joining because I am a community resource navigator and I am seeking a few specific items for families I am currently working with.  Hopefully I will have something to share with others too!
290,156455930,Julie Elliott,North Aurora/Fitzsimons,30 Jul,A.P.D Activity at 17th and Jamaica yesterday around noon. Does anyone know what was going on with the significant amount of police presence at 17th and Jamaica around noon? Seemed a little more than a traffic stop?? Thanks in advance.
291,165781811,Sarah Carrigan,Central Park,26 Oct,"Donations for I Support the Girls. Hello,  my name is Sarah Carrigan, and I am collecting donations for a non-profit called I Support The Girls. This charity takes donations of menstrual products and distributes them to homeless women and women displaced by the wildfires or the pandemic. If you would like to drop off donations, please message me for my address, and I will set a box outside of my house for the donations. If needed, I can also come pick them up directly from you. If you want to learn more about I Support The Girls, their website is isupportthegirls.org. Thank you!"
292,154677621,David Akerson,South Park Hill,12 Jul,What is going to happen with Johnson & Wales? Does anyone know if there are any plans as to what is going to happen to the J&W campus?
293,173384493,Denise Pushnik,Beeler Park,10 Jan,"Package addressed to K. Bivi. Hi neighbors. A delivery from Walmart for K. Bivi was left on our porch in error this morning. If you are K. Bivi, please DM me to describe what was in the delivery so I can return the package to its rightful owner."
294,159002177,Millete Birhanemaskel,Historic Montclair,23 Aug,"Denice Reich admits she is a bigot. I first met Denise when I was 16 and my father was trying to by a house on a janitor's salary. I first saw her signs while being bused to Hill Middle School. We weren't her target buyer. 

As an adult and Black realtor, I admired her mastery of the Montclair/Hilltop area.  Now i see how she and others like her contribute to the reality of these nearly all white neighborhoods in Denver - the fastest gentrifyng city in the country. Her words are far worse than what anyone has said in past posts. 

This county is at a tipping point related to racism and injustice. There are no ""two sides"" here. We all have to expose this type of behavior and call people out even the ones we like or admire"
295,176085033,Amy Yeet,Montbello,5 Feb,"Lost Dogs. There’s two lost dogs, one appears to be a german shepherd and one is a small fluffy light brown pup. They are near enid street, and they both have tags but we can’t seem to get close enough to them. They seem friendly and have a close bond with eachother but seem very scared. They were near the neighborhood walmart in Montbello. If anyone knows anything please help."
296,154432154,News,,,"Mayor Hancock Asks Council to Choose Spots for Safe Camping Sites. From DenverWestword: ""Mayor Hancock is placing the onus on Denver City Council to identify potential temporary safe camping sites."""
297,166254891,KARINA SALINAS,Hoffman Heights,30 Oct,"HALLOWEEN. Hello neighbors! I know this Halloween is different than the rest, COVID has really screwed all our holidays and plans this year. I have two little boys and I'm wondering what to do for them this weekend. Anyone giving out treats tomorrow? Or any parents out here with ideas for their little ones that can share? Hope everyone has a safe & fun weekend!!!"
298,171207610,Timothy Carter,Hale,Denver Homeless Out Loud,"General Update & Introductions. Hello to all of our new members and thank you so much for joining us! It's been heart warming to see our group grow to 30 members in less than a month! It's so good to see that our concerns are shared by others in the community , and that their are so many hands willing to work for good!

We have seen over the past month alone over a dozen sweeps of our Unhoused neighbours numbering in the hundreds of people displaced again and again. Moved from block to block, having their belongings discarded, and thier rights violated. The winter is cold enough already , but the city has been colder still. City council refused last month to adjust spending for homelessness mitigation despite several diverse and well thought out community proposals, in favor of increases to funding for sweeps and police overtime. ( The public education budget for next year is slashed btw & the police department is getting an extra 45 million)

Community volunteers have witnessed much over the past few months alone, police brutality, sexual assault by an officer , Hancocks excuses, city councils failure , and the displacement of hundreds more of our neighbours and friends due to the Covid related unemployment crises. 

But we have also made great strides together. We have a network of volunteers securing, storing, and preparing donations of food for sidewalk soup kitchen service, and soon we will have volunteers on the street every day to help feed and warm not just the homeless , but anyone who cares to stop , with a cup of warm soup or a hot coffee, to lessen the burden of their day. ( Interested in getting directly involved with sidewalk service ? Either securing donations , storing and preparing food and other goods, or helping with sidewalk service , please contact Cats Not Cops on Facebook or DM me for more info )

I apologize for a lack of updates on the sweeps that happened this week. For more consistent updates on sweeps and Denver Homeless Out Loud actions you can sign up for the email updates by emailing info@denverhomlessoutloud.org
These emails are unformated, hand typed updates with no nonsense, advertising or repetitive calls for monitary donations. It's just raw , informative updates on the week to week of our action plan and their results. 

This week the sweep of 16th and Pearl was heartbreaking. We have fed this encampment each week for the past month. Over 150 people who could not be admitted to the new church sponsored safe outdoor space  at 15th and Pearl were shuffled off to nowhere, losing possessions and losing more hope each time. 

I will make a post with updates on the action plan for next week as soon as I am privy."
299,167049733,City of Denver,,6 Nov,"Denver Issues New COVID-19 Restrictions Effective 10 p.m. Sunday, November 8. Denver has issued a ‘Home by 10’ Public Health Order to combat the dramatic increase of new COVID-19 cases and hospitalizations in the city. Effective for 30 days starting Sunday, November 8, all people in Denver should be home by 10 p.m., with certain exceptions, including going to and from work, interstate travel, and getting medical care. During this time, all public and private gatherings of people who are not members of a single household are prohibited, except for limited purposes. 

This is not intended to be a traditional curfew, but rather a restriction on gatherings, business hours, and a guidepost for behavior that will help Denver get through the next 30 days. Any business not defined as critical must close to the public during Home by 10 hours. Critical businesses include, but are not limited to, hospitals, grocery stores, and pharmacies. 

No alcohol sales or consumption after 10 p.m. will be permitted at any facility that sells alcohol, including restaurants and grocery and liquor stores. Restaurants will still be able to offer food takeout and delivery after 10 p.m. Under the new order, groups at restaurants will now be limited to six people from no more than two households, down from 10 people, for the duration of the Home by 10 public health order.

Recreational athletic activities, including organized youth and adult league sports, practices, games, and tournaments, are prohibited. Spectators are prohibited at all post-secondary and Colorado High School Activities Association (CHSAA) sanctioned sporting events.  

The city is taking this action to help stem the increase in cases and hospitalizations and avoid another stay-at-home order being imposed on Denver by the State.

Learn more about the city’s latest restrictions at https://www.denvergov.org/content/denvergov/en/covid-19/public-orders.html."
300,173867862,Anna Bellatorre,Central Park,15 Jan,"Car broken into on E 29th Place in Central Park. Hi Neighbors,

We live on E 29th Place in Central Park between Willow & Xenia. My husband parks on the street and went out to his car this morning. He discovered that it had been opened and rifled through. Initially, I thought they got our garage door opener and a bucket of change, but thankfully, my husband remembered to bring in the garage opener, so they only got the change he uses for parking. We have submitted a police report, but wanted to let our neighbors know. 

I figured it was a good opportunity to remind people to make sure to bring in your garage door openers if you park on the street. I imagine it could have been worse if they could have found and gotten inside the house. . I have reported this information to the police."
301,154481533,leah Jackson,Lowry,10 Jul,"Donating toiletries. Anyone know where I can donate toiletries - small travel soaps/shampoos, tampons (open box but each are individually wrapped), etc? Feels wasteful to throw them out but we’re moving so need to get rid of them."
302,161785478,News,,,"Discussions Continue On Where Sanctioned Homeless Camp Should Be Located. From CBS Denver: ""Denver City Councilwoman Candi CdeBaca joined a town hall on Wednesday night with community activists to talk about how to help those experiencing homelessness."""
303,167881678,Heather Galyon,Central Park,14 Nov,"7/11 not taking proper precautions. Hey just a heads up that the 7/11 on Willow and Northfield has for some reason taken down their plexiglass barriers at the checkout. The hand sanitizer dispensers have been empty the last couple of times I’ve been there. Also, tonight one of the clerks had their mask completely off.

I don’t like being the tattle tale, but as a high risk person, I just want to warn everyone else especially as we are now seeing cases spike yet again. 

Stay safe.

EDIT: OK Neighbors! After seeing this post turn into a weird thread of insults and politics, I’m turning the comments off. I would just like to add that I made this post so that other people who care about COVID precautions in stores can either avoid this gas station completely or avoid going inside. If these things do not bother you, this post should have no effect on you or your gas station preferences, and you are free to happily continue on with your day."
304,169684073,Julio Garcia,Hoffman Heights,3 Dec,"Lock your cars. I was just at the king soopers on Havana and MLK. There is a guy trying to open vehicle doors checking if they’re locked. I tried to approach him, he ran off. If you are in the Stapleton area make sure your vehicle is locked."
305,161329833,Jennifer Ward,East Colfax,14 Sep,"How to improve East Colfax?!?! 2nd Update: A group has been created to continue the conversation about how to improve East Colfax as a community. Here's a link to join the group: https://nextdoor.com/g/o48w6259x/?is=feed_nudge_post
I will share the details on the group about a video call to start productive brainstorming to be scheduled later in week after 8pm. But also feel free to send me a Direct Message if you are interested to be included and I'll send you the details. 
----------------------------------------------------------------
I'm reading this morning posts about the shooting last night on Uinta and I've read several other posts about East Colfax and surrounding neighborhoods having the highest homicide incedents in Denver. I love my neighborhood but as a new mom this really concerns me. On my block (Trenton) alone we now have 5 houses with children... that I know of. I have been frustrated that there are no consistent sidewalks or clean alley ways to walk to Colfax and enjoy some coffee from Pablo's. But now I am awaken to much graver concerns. Im figuring reaching out to our area representative/council member is one approach, but wanted to ask if there are other ways to generate a productive conversation to hopefully lead towards some action? I am sure I am not alone in wanting to see some change. I am sure the best way to help our neighborhood is to join together as a community, but even if that happens, what steps can be taken to reduce the crime? I know it's a systemic issue with unequal opportunities that leads to crime.  I don't know what to do but hopefully your replies to this post will help enlighten me and make it seem possible to make a small impact."
306,157869104,Jarrod Allen,Aurora,12 Aug,Wallet. Lost wallet in parking lot of cricket at 10330 e colfax. I can be reached at 303-519-8034 if someone finds it please call me
307,170855186,Jodi Henni,Skyland,From One Neighbor To Another,"Christmas help. Yes ,I know everyone has been asking. I dont have a car, so I cant do the many toy drives. I thought we were going to be ok, but unexpected events happened. I haven't even been able to pay my phone this month. 
My kiddos are such amazing, kind, a just good kids. I've gotten them some used things off of nextdoor,  and know they will be thankful for that. I want them to have a few new items, because they are amazing. 

My son is 13 autistic, loves kenetic sand, stuffed animals and scientifically correct dinosaurs.
My daughter 11 is very much a preteen ,and loves Harry Potter and crafting.

I have a wishlist since people like to have one. It's just a mix of things they like. I'm not expecting everything or anything for that matter. 

Thank you in advanced. 

https://www.amazon.com/hz/wishlist/ls/20AZJGTSK3254?ref_=wl_share"
308,158777140,David Aba,Lowry,20 Aug,Guy harassing dog owners from his balcony. There’s a mid 50s guy on the top floor of the apartment complex on 8165 E Lowry Blvd (on N Syracuse Ct right before E Academy place on the right hand side) that’s harassed multiple dog owners and cursed at them for walking on the side walk next to his apartment complex. I was walking my dog today and cursed at me several times and told me he’d call the police for walking near his building. I told him I’m on a public sidewalk and kept walking. I live across the street and walk my dog around the neighborhood all the time never had this issue. Some fellow neighbors saw what happened and told me he’s done it to them as well. I just wanted to see if anyone else has been harassed by this person.
309,176084038,kim tatum,East Colfax,From One Neighbor To Another,"clothing need. Hi my husband and I are in really bad need of shoes and we just don't have the income or income to be mobile to get any ourselves. now we have soles broken and holes in the shoes so its now come to me having to ask for some help. 

My shoes I can wear 8.5-9 in guys or 11 in womans
My husband is a 12 WIDE 

clothing is 

husband shirts 3xl, 44/30 for pants
mine is xl shirts, and xl pants (i dont wear jeans)

I am not mobile but located east colfax/yosemite 80220 if anyone can help please by chance. Thank you."
310,151509337,Jamie Tenace Tenace,Lowry,12 Jun,"Men’s clothes. Need some suggestions. My friends husband has passed away and we want to donate his clothes to an organization that will use them. They are really nice dress jackets , lots of ties , long overcoats shirts all kinds of very nice clothes   I know about Second Chance but there are a lot of them and she is elderly and needs help getting them there  is there a place that would pick them up   That’s the problem getting them there.  Any suggestions appreciated. Thx"
311,181929981,News,,,"City inks contract to provide more meals at motel serving families with kids experiencing homelessness. From Denverite: ""The agreement with Volunteers of America renews the city's funding for an emergency shelter for families in West Colfax."""
312,167667986,Darin Wentz,Hoffman Heights,12 Nov,"Trying to help. About 4 months ago i was reading posts on this site and i found a story about this contractor who was shorted on a job he had completed.
He went on to say he was short on rent and that he and his wife and 3 kids would soon be homeless .
I felt super sad for him and had some extra money at the time so i lent him 300 dollars. I never met him before and I knew it was probably not a good idea but something told me to help him everything was great until I asked him when I could have the money back and that's when things went South this money was not a gift and I feel super embarrassed and cheated so Richard Freeman if you're out there could you please return my money....."
313,170778737,Jabby Torres,Hoffman Heights,14 Dec,"pillow wedge. anyone here have a Pillow wedge? I am looking for possibly 4 of them. of anyone has any available would highly appreciate it. or any leg elevation pillow I would need 2 of those only. thank you in advance!

#askyourneighbors"
314,158794076,Liz LaRue,Northeast Park Hill,21 Aug,"If you’ve recently had something stolen... There is a camper and a pickup parked on the side of our house and a camper on the side of the alley full of bikes and suitcases. If you check it out at night you can even stop and pick up some drugs from them, if you so desire. You may want to peruse their inventory for your missing items. I have a feeling these bikes weren’t purchased. 
38th and Pontiac/Poplar near Station 26 brewery"
315,158985611,Frank Barnhart,Aurora,22 Aug,4 Caucasian girls in golf cart. spotted driving west on 29th ave from central park. At 9:55 pm. Cops were called.
316,168215855,Nicole Ryan,East Colfax,18 Nov,"Keep an eye on your dogs. My dog was outside and someone walked by, stopped and looked at him, looked toward the house a couple of times, and then walked off. It was clear there was some pondering going on.

I know dog thefts are common here so I have my gate locked and I’m always watching. 

Just a heads up."
317,168376079,Susan G.,Locust St,19 Nov,"COVID. My daughter was diagnosed with covid-19 today. There are four adults and two children that all live together.  My husband and i also have symptoms of covid.  Everyone else in the house is being tested tomorrow. We all live together because because my daughter her boyfriend and their two kids 4 and 7 years old became homeless. So they moved in us. We are struggling big time and have no way to buy food in general not even buy food for Thanksgiving. If any of my lovely neighbors can please help my family with food, PPE or anything you can. I also called food banks to see if they can get food delivered  but haven't found a food bank that delivers. I applied for unemployment today but don't know when I get it. I have no money to buy or pay for anything. We are all quarantined in the house and need anything you can give ll. I'm so scared now. We will be quarantined to my house now too until we get the test and results. Thank you for taking the time to read this and for any help you can give to my family."
318,155747894,News,,,"Denver Health Tests Those Experiencing Homeless For Coronavirus To Help Prevent Spread. From CBS Denver: ""DENVER (CBS4) - The City of Denver is trying to stop the spread of coronavirus in the streets. Health officials offered testing and other health services to the homeless population in Lincoln Park on Wednesday."""
