,post_id,author,location,date,post
148,163913093,Lindsey Craig,South Park Hill,8 Oct,"Serious Question: Are outdoor cats an abnormal thing in Denver? I have and actual question, not a judgement. 
I’ve noticed since moving to Denver 3 years ago that many people and neighbors post about “found” cats, friendly cats in their yard, or cats that seem well kept without collars roaming around looking for attention. It truly has piqued my curiosity as this is a very common thing, having outdoor, free roaming pet cats, with or without collars where I’m from. 
I want to state that my own two cats are indoor only, but I never really have too much concern for the neighborhood friendly, well kept pet cats that roam around the houses, and seem to just seek some petting. We have several that stop by our home for attention and move on to the next house. Having one that is in actual distress is another matter of course. 
Primary question: Are outdoor cats strange in Denver?"
149,167425005,Ronnie Morales,South Park Hill,10 Nov,homeless housing. plenty of buildings in area 3rd - 7th East of Federal...to Mariposa 3rd - 7th...vacant looking abandoned...could develope a program  for property rehab...job reintroduction for displaced...these individuals could work to help stressed properties...and distressed persons...the city could use programs and enforce code or ordinances to facilitate such programs...very little cost... these programs would balance themselves out with incentives...a win win situation...? should the virus last until 2022? or beyond? FLU of 1918 was of 4 years...this section of the city...would service the four quadrants of the city... I also have other locations...
150,183274903,Carmen Calavera,Hoffman Heights,12 Apr,"**UPDATE CAR IS GONE** Is this your car? This car has no plates and has been sitting on 13th Place for about 1 - 2 months now with the trunk open and what seems to be a not fully shut passanger door. I don't know if it's stolen or abandoned, just hope no one is missing their vehicle. I'm also going to post this to Facebook."
151,171200271,Kailee Olivas,Central Park,18 Dec,Car broken into AGAIN. 24th & Uinta. Hey guys so about 2 months ago my car got broken into and again last night they broke into it they only took a jacket and a pair of sunglasses this time since due to the first time it got broken into I don’t leave anything in my car anymore. They left my car a huge mess and smelling gross. My car was locked by the way just wanted to give a heads up if anyone has any information or saw anything suspicious please let me know and be careful.
152,167403966,News,,,"A Salvation Army campus to help unhoused families get on their feet is slated for Barnum's Alameda Avenue. From Denverite: ""West Denver is about to get the western U.S. headquarters of the nonprofit, too."""
153,171255170,Laurel Watson,Lowry,18 Dec,"Car Broken Into Twice (Lowry area). Has anyone else experienced a break in recently? I’m in the Lowry area, off Fairmount & Alameda. Someone broke in Monday and today, Friday. They rummaged through the console, and glove box and dumped things out, looking for something. I filed two police reports. 
Anyone else experienced a break in?"
154,169002157,Laurie Kagan,Lowry,26 Nov,"WHO NEEDS THANKSGIVING DINNER . . . OR LEFT OVERS TOMORROW?? This is a very late offer. I find myself with up to six extra helping of dinner. Any time after 5:30 or 6:00 a family in need could pick it up (cooked) or I could deliver it. If you are in need, private message me or call me at 720 219-0433."
155,168704457,Deborah Howitt,Central Park,23 Nov,"Blankets and jackets for homeless? We are collecting blankets and adult-size jackets to hand out to the homeless in downtown Denver this Wed.  If you have any to donate, please let me know!  We can either come pick them up from your porch, or we can give you our address to drop them off.  Thank you in advance!!"
156,171863816,Matthew Conn,Berkeley-Regis,Denver Homeless Out Loud,12 years homelessness. This year I was able to get an apartment in  June because of  unemployment benefits from the pandemic.  I need you to understand that this opportunity is for the rest of the homeless community and I have to say that  possibly half the  community has received the same amount of money and the same exact choice as I have had. I'm not going to shy away from the fact that I chose to pay some bills before I bought my drugs and if they don't want to do anything but  blow it all away that's fine but that's a very serious issue that needs to be made aware of and you know the problem will never go away if they are not going to be held accountable for their actions and decisions that they chose to make in the aspect of the homeless community that have had this opportunity for a chance at doing something different than continuing to be a part of the problem as a victim we understand is crap and the only reason we don't have the opportunity for the people to do what they are going around and raging out crying out and being the most important person who was their own individual self oppressed stuck in this situation and NOT you who help continually or anyone else but that individual.  I need you to understand that  only  maybe  half the community or something is being the way of the homeless community never getting the chance they are crying out for and persecuting people who have no role in the decision that person made when they got 7 to 12000 dollars back pay  and then chose to  blow it off with drugs and alcohol and their  whatever other choices. I'm open for you and I to get an interview with each other set and you and I have a lot of questions about time together to make an impact in our understanding of what is going to need to be implemented by us experienced in our own way and we have a very strong and positive attitude towards this standard strategy for the future innovation of all of us getting to the point of being the good and correct stew.
157,175820513,Michael Baca,Central Park,3 Feb,"Central Park at Night. Hello everyone, I have lived in Central Park since March of 2008.  I was talking to a cashier at the new Sprouts because it is apparently deader than a door nail everyday in the evening. One of the craziest phenoms about living in this community is that restaurants and bars struggle because everything goes completely silent once the sun goes down.  

Why does this happen?  Is it because there are so many young families with small children?  Are people afraid to go out and about at night for safety reasons?

Living here for 13 years I find it really strange and I feel for the businesses trying to survive.  Does this mean we'll never have bars with nightlife and live music in Central Park?"
158,169319981,Zoey M.,Lowry,30 Nov,"Need has been met. Need has been met. Hey everyone, I’m just reaching out to see if anyone can help my family of eight. I had my hours cut due to coronavirus and schooling for the month of November. We paid our bills and bought as much as we could but I am now in need of basic items without a paycheck until the 6th. I was only able to work two days total and that paycheck will go to the car payment and for the overdraft for my sons birthday last week. I also have a birthday for my almost 2 year old son on the 11th. I’m not normally the type to ask for help however I’m hopeful there is someone who can.

I am overwhelmed by the amazing neighbors I have in Denver!! You all are truly amazing."
159,166693737,Ali Rodriguez,Hoffman Heights,2 Nov,"*update* Elderly women on 6th and Potomac. Hello yesterday I was passing by Potomac st and 6th right by the gas station and I see this elderly women with and her stuff sitting there I pass by twice and she still was there today my father passed by in the afternoon and she was still there, this breaks my heart and we don’t know how or who can help her I’m sure many people have seen her and no body helps her .*update* I have stop seeing her so I thought she was helped by someone or went to like a homeless shelter but yesterday I was passing 6 and Blackhawk right by the Denny’s on the side I see the lady sitting there !"
160,170969674,Jacqueline Michaelsen,Lowry,15 Dec,"Donation Location(s)? Anyone know where I can donate the following items?
- A bunch of woman’s clothing (size 4)
- A bunch of baby items 
- Some baby food 
- An old box tv with built in dvd and vhs and stand 

Hoping to gift these items to those in need versus just dropping off at Good Will. 

Thanks!"
161,165315202,Jessica Barnes,Central Park,21 Oct,"Urgent Alert. Central Park teen missing nearly 24 hours, no trace of her, she does not have her phone. Please look out!!!"
162,173357473,Christopher Nairn,East Colfax,10 Jan,"Peering Over Fences! I saw a guy peering over my fence and the dogs scared him away! It seemed to me, that he was checking gates and garages. This was Wednesday afternoon/early evening. The same guy was back in the area last night (Saturday) Grey sweatshirt, black bennie and he’s Caucasian..maybe 35-45 years old. He doesn’t appear to be homeless and with all the garage thefts and burglaries I wanted everyone to be on the lookout."
163,174505491,Kathleen Hatsell,Central Park,21 Jan,"Husky mix available to adopt. We are fostering this beautiful gem for Red Fern rescue.

Husky Mix, approximately 77 pounds. He really will be your best Buddy. Buddy ended up in rescue because his owner of 10 years developed health problems and could no longer care for him.

He is smart, a fast learner, easy to have in the house and a pleasure to take on walks. He loves nothing more than laying down and having his belly rubbed. He will visit to put his head on your lap for some pets but isn’t offended if you don’t have time just then. Stays off the furniture, alerts when he needs to go potty (stand by the door).  

He seems perhaps a bit fixated on cats and may do best in a house without them- but has been fantastic with other dogs.  Due to his size, it would be probably best not to be with young kids, but older is fine (our kids are teenagers). 

When he goes on walks, we use a gentle leader and he stays right by our side unless we extend the leash and let him roam. He doesn’t react to bikers, people, cars, or other dogs (even when they lunge at him) he turns his head curiously but keeps on walking. He is simply the best dog to walk, so easy.

Don’t miss out on this amazing dog. He is a love and is very fit and spry for his 10 years. He looks like a much younger dog. He loves a nice walk but is calm and mellow in the house. He clearly came from a good home  and deserves a new home that loves and appreciates this handsome gem. He deserves the best of homes!"
164,170822447,Jolene Johnson,Northeast Park Hill,14 Dec,Christmas Assistance. There’s all the resources for you too attend for help with Christmas
165,178581267,Dara Clifton,Central Park,28 Feb,"Introduction. Hello, I’m Dara and my family and I just moved to Central Park from downtown Denver. We have two little boys, and I also do childcare in my home, but recently took a long break from it when my baby was born/the pandemic hit. My question for locals is; what’s the best Chinese food around here?"
166,171331164,Michael Chalchesa,Montbello,19 Dec,"Hi, I'm Michael. 👋 Nice to meet you. Hello my name is Michael I been in this neighborhood for about 15 years or so. I’m very big helping out my community and helping out the homeless on a monthly basis. I just found out about this app and if anyone is free or willing to donate anything at all don’t hesitate to reach out to me."
167,177293056,Roy Wilz,Thornton,From One Neighbor To Another,"Broken down truck needed for work. Hello, friends and neighbors, Roy the recycler here. I am autism spectrum, suffer from PTSD and am homeless and need your help getting my truck fixed. I don't ask for much, this is my first go fund me. If you have anything extra at this time please pay it forward, we would be very grateful. Any help would be greatly appreciated God bless! 

 You can pay towards the bill directly, ask for Mark at Mountain View Automotive 720 464 7624.

 The cost covers pulling the fuel tank down off the truck putting in a new fuel pump, changing the oil, changing the serpentin belt, changing the coolant, Changing the front and rear brakes and putting new tires on the truck as well as some odds and ends."
168,181607435,Christopher Belila,Aurora Arts District,28 Mar,"We are A-Town! Post cleanup update. Thanks to all the volunteers who helped with yesterday's cleanup. Our next one is scheduled for Saturday April 24th.  We've partnered with Waste Management to provide 2 roll-off dumpsters for residents to throw away large items. More on this soon.

My dog Lucy and I went for a walk this morning in the Art's District and it still looks pretty good.  However, I was struck by s liquor store at Florence St and Colfax.  Volunteers cleaned up the area in front and across the street from the liquor store, and we must have picked up 30 empty shot or 1/5 bottles.  This morning there was just as many empty bottles.  I noticed the store opens at 8:00 each day, and customers are pouring in there, and some are throwing out empty bottles almost immediately.

The question I have is should businesses that contributes to homeless, alcoholism, and an unsavory environment be allowed to stay open.  I'm going to lobby the city council to change the zoning rules for the Art's District.  

I may start a petition to garner support and show city council this is important.

Have a great day.  Chris"
169,166546846,Isaac Rivera,East Colfax,1 Nov,"Stolen Bike. My bike was stolen last night and here’s a photo of it please message me if you see it.
Thank you"
170,172404863,City of Denver,,1 Jan,"Minimum Wage Change - January 1, 2021. Starting today, ordinance requires every employer in the City and County of Denver pay their employees at least $14.77 per hour, with few exceptions. “This is a truly challenging time for businesses, and I want to work with them to find ways to keep their employees paid according to the law,” Auditor O’Brien said. Read more below.

A partir de hoy, la ordenanza exige que todos los empleadores de la Ciudad y el Condado de Denver paguen a sus empleados al menos $14.77 por hora, con pocas excepciones. ""Este es un momento especialmente delicado para los negocios y quiero trabajar con ellos para que sigan pagando a sus empleados de acuerdo con la ley"", dijo el Auditor O’Brien. Lea más a continuación."
171,173823931,Liz Samioglou,East Colfax,14 Jan,"Missing cat? Hi I was hoping to find this cats owner I have been seeing him around ,I just noticed he has been sleeping in our crawl space sneaking in through a  hole in it, I have too many animals to take him in, we have to close the hole due to him going to the bathroom in the craw space ; leaving him homeless .he is so sweet I fed him some cat food tonight because he was crying so bad. Please let me know if he’s yours."
172,169841811,Krystal L.,Arvada Columbine,From One Neighbor To Another,"So blessed. A year ago i walked away from an abusive relationship which left me struggling financially. I am a single mom with 3 teenagers and one adult child who lives away from home, I work very hard to provide for my children who might i add are some of the most amazing young people, they truly are my whole world. The passed few months it has gotten harder and harder to make ends meet after exhausting my savings and 401k. Without the help from nextdoor i honestly dont know how we would have survived and i am beyond thankful that good people still exist. I just wanted to post this for those who are weary about giving to share my story and let you know how greatful i am for the help i have received. Its not easy raising kids alone in these times and it feels really good to call my community family."
173,166840631,News,,,"From Fast Company: ""In passing Proposition 118, Colorado just became the first state to secure paid family leave through a ballot measure.""
#election2020"
174,168827271,Shannon Henderson,North Aurora/Fitzsimons,24 Nov,"Intruder. Hi all,

Last night we had an intruder inside our house just before 1am. We are on Nome near Montview.

The dog started barking and it seems we didn’t properly latch the back door. My partner called out and she identified herself. She had a large bag with her and asked to stay for a bit because she was tired from traveling. She was agreeable to leaving, but asked several more times if she could stay. 

I don’t think she had any malicious intent (nothing was taken or damaged), just looking for a warm place to hang out. 

Nothing bad happened and she was agreeable to moving along, but just a reminder to double check that your doors are locked at night!"
175,177074158,Angel Brogdon,Northeast Park Hill,15 Feb,Jumper cables. Does anyone have any jumper cables near 35th and Newport that can possibly help jump my truck
176,176992544,Roy Wilz,Thornton,From One Neighbor To Another,"Broken down truck need for work. Hello niebors, Roy the recycler here, a lot of you may know me because I picked up your scrap metal. I am autism spectrum, homeless and need your help getting my truck fixed/ Diagnosed. I need to get it to Mountain View Automotive, should cost about a $100 to get  Diagnosed.

   If anyone would like to help pay the bill at(Mark@MVA) Mountain View automotive In my name, Roy Wilz the truck is a 1994 Ford Ranger we would be very grateful. My guess is that it's the fuel pump, the battery was just replaced by some kind neighbours last month, it worked for couple weeks and now this new problem surfaced. Any help would be greatly appreciated God bless! PM me if you can help!Thanks"
177,178492714,Claire Clark,East Colfax,27 Feb,Moving boxes. In search of moving boxes. Do you have leftovers from your move?  #Askyourneighbors
178,176405872,Ruby Robledo,Montbello,9 Feb,Food coloring. Hi plz help I need to look other than Amazon ! for chocolate food coloring does anyone here know we’re I can buy ASAP I have many orders for valentines strawberries and not enough color looking for red pink chocolate coloring? I need to go ASAP so plz help !
179,176585434,Shelby Campbell,Hoffman Heights,10 Feb,Job. Does anyone know of anywhere in the general area that is hiring ?
180,170158538,Brittany Tracy,Aurora,8 Dec,Christmas. Hello Everyone I am a single mom seeking any type of help this holiday season I have two young daughters who I would like to give something for Christmas. Homeless Out of work and father is in prison if you know any resources please let me know. Thank you so much Happy holidays! ❤️
181,169919213,Vanessa Marlyn V Watkins,Aurora Cultural Arts District,6 Dec,"My thoughts exactly! If you don't agree keep scrolling 🤷‍♀️. In the next 4-8 weeks, you'll all be seeing the ""We need to re-home our pet..."" posts. These are the people who went ahead and purchased puppies, kittens, rabbits...etc. as Christmas gifts who are suddenly allergic, moving, having a baby, don't have time, their kids won't take care of it, didn't think they'd get so big, didn't think they shed, didn't think they needed food....

Problem is, 90% of unwanted pets end up in kill shelters. 

Allow me to break it down for you. 

You didn't know you had an allergy? Oops. Don't let the pet suffer, buy some allergy medicine. 

You're moving? What city are you moving to that doesn't allow dogs? Bullshitville? You have a responsibility to your living, breathing family member to plan ahead to find a house, apartment or condo that will ALLOW your family member. Period. I would be HOMELESS with my pet before giving them up.

Oh, you had no idea you were due to have a baby in 2 months? Didn't know that's how it worked.. Get a dog trainer and remember that the pet was your child first. 

Don't have time to let a dog out, or to have a dog just sit next to you while you're home? Really? So they're better off in a shelter than waiting in your house for you to get home? Ok, perhaps get another pet to keep them company or look for a local dog-sitter. 

Oh, you mean your five-year-old didn't step up to the plate to feed, walk and scoop poop like they promised? I guess it's time for YOU to step up and role model for your child.

Wrong size? Not cute as an adult? Sheds too much? Barks? Breathes? Not quite the personality you expected? Look in a mirror, how did you turn out? Should we send you back? 😡 

Guess what? If the roles were reversed, your dog would NEVER LET YOU GO.

Photo from Ross County Humane Society
Reposting 2020"
182,165393518,Chaya Alla,South Park Hill,22 Oct,"men's clothes donations. we have some blazers, jeans and shirts to be given away.  i checked impactlocally and a couple other places.  seems like they are not taking donations currently due to covid 
any other place i can donate?
they all are in really good shape
kindly
chaya"
183,176720510,Elexis Martinez,Westy Hills,From One Neighbor To Another,"Newborn girl clothes. Hello everyone. I'm reaching out here to see if anyone has any baby girl clothes (newborn and other sizes) my baby girl is due in a few weeks and I've been struggling financially. Also if anyone has some pacifiers, pacifier clips, swaddles and some towels that would be amazing. I'm located in Arvada and would possibly need someone to drop off since my car wont start. Any help would be really appreciated. Thank you!"
184,166908712,City of Denver,,5 Nov,"Help Denver Parks & Recreation Grow! Denver Parks & Recreation wants to grow the parks system! Let us know what matters most to you and what to prioritize. Take the survey now: https://designworkshop.co1.qualtrics.com/jfe/form/SV_e3Ec4SRHbkdR38h

¡Denver Parks & Recreation quiere crecer el sistema de parques! Dejarnos saber  lo qué es más importante para usted y qué necesitamos priorizar. 
Complete la encuesta ahora:  https://designworkshop.co1.qualtrics.com/jfe/form/SV_e3Ec4SRHbkdR38h

Learn more at www.denvergov.org/parkprojects"
185,162206217,Jude Wolf,South Park Hill,22 Sep,"Vote to end breed specific legislation. **update: remember to vote and do your own research rather than listening to biased comments in this discussion. We can not punish innocent dogs and responsible owners by keeping a ban that is proven to be ineffective! 🐶💕

Vote YES on 2J this November to end Denver’s ban on pit bulls and implement dog laws that focus on responsible dog ownership!

Why?
Breed specific legislation doesn’t make cities safer. Breed isn’t an indicator of whether or not a dog will bite- responsible ownership is. It is proven that pit bulls are not disproportionately dangerous compared to other dogs. Enforcing Denver’s ban on pit bulls has cost the city over $5.8 million. Denver already has rules in place about animal attacks, bites, and dangerous animals. Overall it is discriminatory against responsible owners and their dogs. Thousands of family dogs have been euthanized because of this ban.

If you are interested in learning more, watch Beyond the Myth on amazon prime or reach out for more resources!

New legislation:
1. All pit bulls will be required to be microchipped.

2. All pit bulls will be required to be spayed or neutered. 

3. Only two pit bulls will be allowed per home.

4. Owners will be required to notify animal control if their dog escapes.

5. If after three years there are no issues, the pup will qualify for a standard dog license."
186,169495720,Samantha Sheppard,East Colfax,2 Dec,"Man on Porch 2am. Hi neighbors, just wanted to let you know there was an unknown man on my porch for a bit tonight. My dog woke me up around 1:30 to let me know something was up. He didn’t knock I don’t know if he was trying to break in or not. I turned on lights and asked him to leave and he said “sorry I have the wrong house” but did not leave the porch steps or driveway. I called 911 they sent an officer out to get him to go. The officer called and said the man gave the same story of “having the wrong house.” This is around 16th and Tamarac. He was wearing a black jacket, a beanie, and carrying two duffle bags."
187,184130356,News,,,"Denver legalizes weed delivery (and other things to know about the biggest overhaul ever to the city's marijuana laws). From Denverite: ""City Council passed the biggest changes to the city's marijuana laws since recreational sales began."""
